order_key,customer_key,order_status,total_price,order_date,order_priority,clerk,ship_priority,comments
821,299,Pending,166.83,2024-01-18,Low,Perry Cooper,2,Art some nation pass say pass.
822,266,Processing,447.36,2024-01-11,Low,Norman Moses,1,Before be attack myself time heavy.
823,35,Pending,652.18,2024-02-13,High,Riley Figueroa,5,Marriage grow organization hotel many certainly within car.
824,492,Pending,106.2,2024-02-10,Low,Rhonda Bartlett,3,Hundred blood his.
825,156,Shipped,182.11,2024-01-24,Low,Cheryl Martinez,1,Season we medical word anyone bar wish our.
826,359,Shipped,903.28,2024-02-10,Medium,Jimmy Hernandez,2,Couple public society stay.
827,88,Shipped,424.13,2024-01-27,Medium,Rebecca Turner,4,None great film food authority people.
828,93,Processing,996.34,2024-01-25,Medium,Michael Fernandez,3,Must realize hit yeah thought.
829,430,Pending,707.13,2024-02-07,Medium,Benjamin Williams,5,Third arrive community threat season important.
830,390,Shipped,268.03,2024-01-09,Medium,Jennifer Gonzalez,1,Think candidate as growth.
831,404,Shipped,313.7,2024-01-12,Low,Scott Fields,1,Television left small produce method western light window.
832,174,Processing,751.01,2024-01-16,Low,Joseph Lopez,5,Debate on send.
833,321,Shipped,226.05,2024-02-06,High,John Medina,4,Risk simply owner beat why.
834,182,Processing,757.19,2024-01-01,High,Cynthia Yu,1,Else edge get available.
835,276,Shipped,918.39,2024-02-08,Medium,Kim Arias,1,Trip consider true nearly.
836,243,Pending,447.86,2024-02-13,Medium,Michelle Ellis,2,Look teach coach probably daughter relate.
837,433,Processing,855.23,2024-01-04,Medium,Dr. Christy Adams,2,May mission everything then course.
838,65,Processing,380.68,2024-01-18,Low,David Cole,3,So she garden performance toward senior animal.
839,23,Pending,847.43,2024-01-20,Low,Brian Thompson,5,Environment south hope a draw anything yes.
840,338,Processing,199.34,2024-02-06,Medium,Scott Mathis,2,Property alone expert listen third.
841,368,Shipped,142.72,2024-01-26,Low,Stephen Proctor,2,Also leg get church set choose business.
842,265,Pending,122.32,2024-01-12,Low,Anne Walker,5,College return cut land particularly tax mean score.
843,463,Shipped,421.21,2024-01-07,Low,Margaret Garcia,2,Speak speech owner upon something.
844,56,Pending,171.41,2024-01-21,Low,Janet Andrews,3,Into nation house short may.
845,493,Pending,752.17,2024-01-23,High,Carol Miller,5,Old safe others dinner.
846,42,Processing,669.39,2024-01-10,High,Jill Gomez,4,More street work place dinner region fear continue.
847,192,Pending,497.49,2024-01-17,Medium,Eric Martinez,1,Sure everybody foot.
848,406,Processing,66.24,2024-01-20,Low,Ryan Cruz,4,Country it usually teach message feeling speak difficult.
849,258,Processing,997.93,2024-01-08,Low,Tricia Gonzales,4,Around case necessary produce.
850,189,Processing,938.98,2024-01-24,Medium,Maria Brown,2,Southern organization job find blood laugh particularly.
851,330,Shipped,772.0,2024-01-07,Low,Dustin Raymond,4,Child race determine foreign partner generation of.
852,143,Pending,996.26,2024-01-25,Medium,Megan Mendez,5,Difficult control woman half.
853,348,Shipped,744.8,2024-01-12,Medium,Mary Tucker,5,Least ok back.
854,335,Processing,923.71,2024-02-09,Medium,Jeremy Hill,2,Could letter often address amount.
855,351,Processing,986.94,2024-01-03,Medium,Lauren Simmons,5,Lawyer customer others really send language technology.
856,48,Shipped,603.71,2024-01-24,High,Heidi Roberts,4,If if direction glass degree main hope.
857,474,Pending,762.67,2024-02-06,Medium,Matthew Knight,2,Generation anyone a he.
858,419,Processing,417.6,2024-01-05,High,Wendy Cox,1,Want cold light skill.
859,50,Pending,399.27,2024-01-21,High,James Khan,4,Individual policy just by.
860,149,Shipped,608.36,2024-02-06,High,Lauren Foster,5,Look citizen foreign phone eye final machine point.
861,172,Pending,915.91,2024-02-03,High,Brittany Evans,1,Meeting same they.
862,162,Processing,232.04,2024-02-11,High,Jillian Rodriguez,5,Happy maintain history.
863,121,Pending,759.54,2024-01-10,Low,Kaitlyn Williams,3,Of charge north simple.
864,292,Shipped,89.51,2024-02-08,High,Bradley Peterson,1,In full something present.
865,466,Processing,572.81,2024-01-05,Low,Shane Christensen,1,Discover area what end first tonight.
866,404,Processing,284.89,2024-01-14,Low,Meghan Collins,2,Professor house low.
867,376,Processing,277.78,2024-01-10,High,Dr. Laura Harrison,1,Hear difficult price life among president study.
868,43,Processing,617.61,2024-01-17,Low,Mr. Mark Lopez,3,Wish through choice describe wish walk itself.
869,77,Pending,936.58,2024-01-23,Low,Casey Hall,1,Letter either particular price.
870,479,Processing,539.71,2024-01-02,Low,Brent Murphy,5,Its young note soldier.
871,265,Pending,914.8,2024-02-05,Medium,Gregory Gutierrez,5,Partner enough project.
872,325,Processing,229.43,2024-01-27,Medium,Robert Griffin,1,Arrive material can well where inside man blood.
873,143,Processing,897.63,2024-02-08,Medium,Brandon Gonzalez,2,Even must anything medical system church first thank.
874,362,Pending,601.44,2024-01-06,Low,Sean Johnson,1,Happen traditional together out sing.
875,482,Processing,295.95,2024-01-21,Medium,Melissa Norris,1,North unit customer design sometimes join administration around.
876,433,Shipped,853.48,2024-02-12,High,Alison Fleming,2,Sister ability send.
877,258,Shipped,538.51,2024-02-07,Low,Marco Ellis,5,Wonder girl necessary artist method capital nothing.
878,465,Shipped,613.95,2024-01-05,Low,Jackson Andrade,2,Perform realize radio recognize.
879,303,Pending,457.23,2024-02-06,Medium,Donna Foster,3,Baby fill list physical.
880,209,Shipped,515.47,2024-01-05,Medium,Tara Hoffman,3,Speak bill anything evidence.
881,480,Processing,112.78,2024-02-11,Low,Richard Potts,3,Prove stand perhaps than his.
882,313,Shipped,300.57,2024-02-01,High,Tammy Myers,3,Wife write recent check name.
883,414,Processing,507.94,2024-01-05,Low,Derrick Johnson,1,Station visit prevent major around main value.
884,215,Pending,814.38,2024-02-02,Medium,Christopher Hernandez,5,Nation its laugh news spring other.
885,478,Pending,611.66,2024-02-11,Low,Stephanie Cox,3,Professional stock fill try prove.
886,486,Pending,62.64,2024-01-20,Low,Douglas Perry,3,Keep mother somebody place but PM speak.
887,367,Shipped,685.53,2024-01-30,Medium,Mariah Carr,4,Apply nothing could there start job send yeah.
888,452,Processing,875.78,2024-02-08,Medium,Ethan Delgado,2,Seem imagine standard read as meet consumer.
889,345,Shipped,804.27,2024-01-11,Low,Ashley Dennis,1,Information subject TV live.
890,329,Pending,999.09,2024-01-12,Medium,David Wong,3,Sometimes key act any.
891,214,Processing,331.3,2024-01-23,Low,Dustin Davis,5,Question hope among authority speak.
892,249,Shipped,377.47,2024-02-10,Low,Carlos Murray,3,Listen pull identify.
893,281,Pending,153.57,2024-01-27,Low,Danielle Johnston,3,National second always seat avoid each indicate.
894,286,Pending,914.29,2024-01-29,Medium,Matthew Diaz,2,Main again along open.
895,140,Pending,535.2,2024-01-18,Low,Christopher Fields,4,Scientist forward level yet talk discuss.
896,206,Pending,973.45,2024-01-06,Medium,Patricia Acosta MD,5,Unit even talk hour purpose I.
897,385,Shipped,889.49,2024-02-01,Low,Robert Butler,1,Answer billion deep space.
898,412,Pending,610.61,2024-01-19,Low,Terry Barker,5,Always seek develop station describe.
899,313,Processing,208.91,2024-01-12,Low,Jasmine Lopez,4,Be peace herself evening.
900,112,Shipped,64.17,2024-01-10,Low,William Krause,3,Form guess meet office perform race major.
901,302,Shipped,808.84,2024-01-14,Low,Michael Pollard,5,Street Congress treatment chance big save.
902,228,Shipped,941.41,2024-01-02,High,Melanie Horn,1,Establish ten suggest because long wide new score.
903,219,Shipped,365.61,2024-01-20,High,Alicia Hughes,1,Under soldier enough money.
904,190,Shipped,388.09,2024-01-30,Medium,Meghan Ross,3,Possible national movie worry meeting.
905,456,Shipped,382.3,2024-01-11,Low,Wayne Yoder,3,North trade plan interesting sometimes.
906,160,Processing,286.56,2024-01-05,Medium,Shawn Washington,1,Skin sing nice system election.
907,91,Shipped,981.94,2024-02-11,Low,Michael Diaz,4,Leg sea spring experience her.
908,221,Shipped,531.99,2024-02-04,Medium,Robert Alvarado,5,Society collection form anything type.
909,96,Shipped,937.27,2024-01-26,High,Mariah Austin,3,Cell truth city trial.
910,188,Shipped,683.03,2024-01-06,High,Rachael Hernandez,5,For class table add.
911,419,Pending,257.77,2024-02-06,Low,Noah Harding,2,Bed other financial success.
912,140,Processing,322.33,2024-01-07,Low,Robert Gray,3,Describe accept less matter require to.
913,357,Pending,663.21,2024-01-26,High,David Mason,4,Much any likely place.
914,37,Processing,81.11,2024-01-06,Low,Angela Smith,1,Couple light bring return detail money.
915,59,Shipped,665.76,2024-01-22,Medium,Rebecca Stevens,5,Finish require morning audience thought threat yourself.
916,93,Shipped,604.64,2024-02-02,Low,Wesley Rollins,4,Wide method tough garden something loss every father.
917,438,Shipped,660.68,2024-02-05,High,Mitchell Butler,1,Seat brother make maintain cost network argue.
918,62,Pending,542.32,2024-01-21,Low,Scott Munoz,4,Individual near interview.
919,73,Processing,640.62,2024-02-11,Low,Susan Harrington,1,Professor notice hit strong.
920,495,Processing,530.98,2024-01-10,Low,Kelsey Turner,2,Finish above a type respond position.
921,180,Processing,237.15,2024-01-31,High,Wendy Chavez,1,Address law whom ground blood sort mention.
922,360,Processing,427.4,2024-01-23,Low,Dustin Dorsey,2,Speak who least drive sound region.
923,197,Shipped,172.69,2024-01-23,Medium,Blake Cummings,3,Fear road give center.
924,327,Pending,241.69,2024-01-11,Low,Thomas Moore,2,Happy young family relate material.
925,377,Pending,254.49,2024-01-28,Medium,Hannah Lee,5,Clear defense myself past.
926,486,Shipped,647.5,2024-01-02,Medium,Randy Bradley,3,Figure yet drug use cultural.
927,144,Pending,76.31,2024-02-08,Low,Deborah Parker,3,Develop however knowledge different I matter.
928,56,Pending,661.37,2024-01-03,High,Carlos Miller,3,Home sign if concern attention work.
929,379,Pending,255.29,2024-01-15,High,Scott Fox,3,Recently five necessary night politics.
930,221,Processing,622.83,2024-02-12,Low,Gary Martinez,4,Teach mouth school bill happy end.
931,23,Processing,848.7,2024-02-11,Low,Nicole Cabrera,4,Loss manager sing body.
932,92,Pending,783.73,2024-01-19,Medium,Daniel Jones,1,Decision always method area hospital.
933,322,Pending,462.76,2024-01-10,Low,Daniel Harrison,4,Energy hit this.
934,126,Pending,734.49,2024-01-07,Low,Katie Willis,3,Meeting TV ahead red.
935,357,Pending,660.02,2024-01-23,Medium,Scott Villarreal,3,Try body not guy.
936,179,Processing,632.1,2024-01-15,Low,Ronnie Brown,3,Leg really staff chair ability.
937,413,Shipped,700.56,2024-01-28,Low,Amy Smith,1,Test list consider though reason.
938,184,Shipped,464.18,2024-01-09,Medium,David Conrad,5,Quickly want stand better trade floor.
939,8,Shipped,791.61,2024-02-06,Low,Regina Sanchez,5,Allow be read.
940,11,Shipped,707.72,2024-01-06,Medium,Joe Durham,2,Home care yeah have.
941,169,Shipped,399.83,2024-01-07,High,Shannon Coleman,4,Senior way road sometimes firm policy country.
942,303,Pending,736.25,2024-01-28,Medium,Marco Johnson,3,Trouble civil human dream phone huge oil.
943,144,Pending,981.34,2024-01-31,High,Heather Mann,5,Common single current action represent situation hand.
944,354,Pending,404.45,2024-01-14,High,Walter Lopez,3,General help century section ten region.
945,12,Processing,449.34,2024-01-22,Low,Karen Powell,5,Build event assume tree at.
946,489,Shipped,325.93,2024-01-14,High,Edgar Austin,5,Both night money find deep call.
947,10,Processing,882.74,2024-01-27,High,Abigail Morgan,1,Decide nearly coach.
948,88,Pending,66.98,2024-02-10,Low,Beth Murphy,4,Admit decade their church because never so.
949,483,Processing,374.16,2024-01-28,Low,Michael Ruiz,4,Class indeed avoid summer economic.
950,495,Pending,710.79,2024-02-09,Low,Natalie Osborne,2,Campaign quality set improve reach.
951,222,Processing,708.3,2024-02-01,High,Connor Carpenter,1,Stuff computer recent employee positive guess.
952,170,Shipped,330.86,2024-01-27,Low,Ashley Richardson,1,Wall race particular bank really level director.
953,316,Pending,987.3,2024-02-09,Low,Julie Rodriguez,3,Want continue respond rock for.
954,42,Pending,259.52,2024-01-02,High,Danielle Walker,5,Care smile network factor.
955,435,Processing,823.9,2024-01-04,Low,Patricia Cook DVM,1,Design role through.
956,127,Pending,261.1,2024-02-05,High,Randall Richards,4,Report everything decide believe culture detail.
957,36,Pending,864.28,2024-01-06,High,James Stone,5,Education your bring responsibility enter.
958,16,Processing,66.98,2024-01-17,Medium,Kayla Roman,4,Somebody its house behavior indeed together.
959,160,Shipped,152.54,2024-01-20,Low,Alison Lambert,5,Range finish writer find save.
960,18,Shipped,801.8,2024-02-12,Low,Nathaniel Lyons,1,Senior deep result health.
961,241,Processing,974.35,2024-01-12,Low,Jenna Carter,5,Everybody thank produce.
962,56,Shipped,115.08,2024-01-07,Medium,Brittany Rodriguez,5,Space box spring safe join industry.
963,456,Pending,754.59,2024-01-10,Medium,Anna Jones,2,City hotel former bed.
964,110,Processing,886.99,2024-01-22,Low,Andrea Daniels,5,Popular work true.
965,458,Shipped,192.6,2024-01-19,Medium,Jill Lamb,1,Sister hot brother stay second way age.
966,176,Processing,204.38,2024-01-17,Low,Julian Boyle,4,World federal key available subject buy produce environment.
967,372,Pending,435.23,2024-01-29,High,Timothy Farmer,4,Window entire while place describe.
968,183,Processing,900.87,2024-02-07,Low,Elizabeth Schmitt,2,Share skin administration recently accept teach other story.
969,335,Processing,605.95,2024-01-07,Low,Angela Bowen,5,Attack dream expect have table.
970,422,Processing,287.95,2024-01-24,Low,David Michael,5,Design know wrong receive spend today half.
971,468,Processing,207.18,2024-01-28,Medium,David Fletcher,3,Argue my television everyone white Mrs seem.
972,481,Pending,581.95,2024-02-12,High,Christopher Shannon,2,Matter site radio purpose sound why lawyer.
973,273,Pending,24.65,2024-02-10,High,David Garcia,1,Particular take make five food.
974,233,Shipped,315.64,2024-01-15,Medium,Carrie Monroe,1,Opportunity computer east through.
975,124,Shipped,360.56,2024-01-07,High,Amy Mccullough,4,How theory see interesting direction walk question.
976,367,Processing,805.94,2024-01-06,Low,Derek Bird,3,Scientist during indicate person kitchen.
977,123,Processing,83.18,2024-02-01,High,Victoria Tucker,5,Movie approach turn purpose bag wear.
978,38,Pending,690.56,2024-01-24,Medium,Scott Miller,2,Community alone daughter act shoulder talk.
979,394,Processing,682.77,2024-01-22,Low,Ronald Morales,1,Future of trade glass around about.
980,176,Processing,592.83,2024-02-11,Low,Dustin Howell,4,Discussion simply help member more able mother.
981,334,Processing,737.61,2024-02-02,Medium,Brenda Mccarty,5,Production order different expert.
982,448,Shipped,381.96,2024-01-29,Low,Paul Johnson,2,Up hard card into catch necessary.
983,126,Shipped,769.41,2024-01-30,Medium,Joshua Bradley,4,Goal year argue suddenly especially consider there language.
984,168,Processing,531.55,2024-01-28,High,David Owens,5,History computer support career doctor much sea.
985,371,Processing,848.01,2024-01-21,Medium,Dawn Griffin,1,Nature pay always choice audience inside tree reflect.
986,230,Processing,56.72,2024-01-18,Low,Michael Green,2,Sense memory minute myself somebody.
987,75,Shipped,334.26,2024-01-19,Medium,Philip Miller,4,Choice think win step.
988,121,Shipped,513.77,2024-01-27,High,Stuart Smith,2,Perform until sense pull short low yes.
989,173,Pending,41.0,2024-01-02,High,Bradley Le,3,Everyone television which.
990,40,Shipped,606.25,2024-02-04,Medium,Taylor Bautista,4,Common investment option second.
991,333,Pending,759.68,2024-01-04,High,Courtney Jones,5,Bank stop understand notice role professor member hard.
992,295,Shipped,865.09,2024-02-05,High,Kimberly Ramirez,3,Myself but method.
993,313,Pending,622.07,2024-02-01,Low,Randy Hudson,1,Age law example would.
994,457,Processing,76.16,2024-01-15,Low,Vanessa Fry,3,Have keep tree current upon read air.
995,130,Pending,768.15,2024-01-27,Low,William Molina,2,Machine medical weight.
996,244,Shipped,35.86,2024-01-10,High,James Garrett,2,Difficult total include friend reason see.
997,25,Pending,368.38,2024-01-10,Low,Anthony Webb,2,Institution officer second.
998,412,Processing,822.48,2024-01-07,High,Tim Howell,1,Hour stuff nor first kid far manager.
999,140,Pending,206.61,2024-01-13,Low,Leslie Turner,5,Toward party society.
1000,273,Shipped,378.44,2024-01-28,High,Nicholas Mendez,4,Forward card adult tonight.
